{
  "schemaVersion": "omnitwin.foundry.activation-v1-gateway-token-commitment-proposal-vectors.v0",
  "authority": "none",
  "contractStatus": "proposed_not_frozen",
  "implementationStatus": "not_implemented",
  "semanticValidation": "vector_expectation_only",
  "databaseAdmission": "not_performed",
  "positiveCases": [
    {
      "caseId": "submit_gateway_valid",
      "payload": {
        "authority": "none",
        "environmentId": "fixture-eu",
        "evidenceId": "11111111-1111-4111-8111-111111111111",
        "evidenceKind": "gateway_token_commitment",
        "expiresAt": "2026-07-15T12:02:00.000+00:00",
        "issuedAt": "2026-07-15T12:00:00.000+00:00",
        "nonceSha256": "sha256:aaaaaaaaaaaaaaaaaaaaaaaaaaaaaaaaaaaaaaaaaaaaaaaaaaaaaaaaaaaaaaaa",
        "observedAt": "2026-07-15T12:00:00.250+00:00",
        "projectId": "grand-hall",
        "purpose": "provider_command_claim_token",
        "queueScope": "submit.normalized-glb-v0",
        "redemptionTokenSha256": "sha256:bbbbbbbbbbbbbbbbbbbbbbbbbbbbbbbbbbbbbbbbbbbbbbbbbbbbbbbbbbbbbbbb",
        "schemaVersion": "omnitwin.foundry.derivative-gateway-token-commitment.v1",
        "signerAuthorizationId": "22222222-2222-4222-8222-222222222222",
        "signerAuthorizationSha256": "sha256:cccccccccccccccccccccccccccccccccccccccccccccccccccccccccccccccc",
        "subjectId": "44444444-4444-4444-8444-444444444444",
        "subjectKind": "provider_command",
        "subjectSha256": "sha256:eeeeeeeeeeeeeeeeeeeeeeeeeeeeeeeeeeeeeeeeeeeeeeeeeeeeeeeeeeeeeeee",
        "targetCallerAuthorizationId": "33333333-3333-4333-8333-333333333333",
        "targetCallerAuthorizationSha256": "sha256:dddddddddddddddddddddddddddddddddddddddddddddddddddddddddddddddd",
        "targetPlane": "submit_gateway",
        "tenantId": "venviewer"
      },
      "expectedContext": {
        "environmentId": "fixture-eu",
        "maximumExpiresAt": "2026-07-15T12:02:00.000+00:00",
        "projectId": "grand-hall",
        "queueScope": "submit.normalized-glb-v0",
        "schemaVersion": "omnitwin.foundry.activation-v1-gateway-token-commitment-expected-context.v0",
        "signerAuthorizationId": "22222222-2222-4222-8222-222222222222",
        "signerAuthorizationSha256": "sha256:cccccccccccccccccccccccccccccccccccccccccccccccccccccccccccccccc",
        "subjectId": "44444444-4444-4444-8444-444444444444",
        "subjectSha256": "sha256:eeeeeeeeeeeeeeeeeeeeeeeeeeeeeeeeeeeeeeeeeeeeeeeeeeeeeeeeeeeeeeee",
        "targetCallerAuthorizationId": "33333333-3333-4333-8333-333333333333",
        "targetCallerAuthorizationSha256": "sha256:dddddddddddddddddddddddddddddddddddddddddddddddddddddddddddddddd",
        "targetPlane": "submit_gateway",
        "tenantId": "venviewer"
      },
      "expectedResult": {
        "authority": "none",
        "canonicalByteVerification": "not_performed",
        "databaseAdmission": "not_performed",
        "evidenceId": "11111111-1111-4111-8111-111111111111",
        "nonceUniqueness": "not_performed",
        "queueDelivery": "not_performed",
        "redemptionTokenGeneration": "not_performed",
        "runtimeAuthority": "none",
        "schemaVersion": "omnitwin.foundry.activation-v1-gateway-token-commitment-semantic-validation.v0",
        "semanticValidation": "passed",
        "signatureVerification": "not_performed",
        "signerAuthorizationCurrentness": "not_performed",
        "signerTargetPairing": "not_performed",
        "targetCallerCurrentness": "not_performed",
        "targetPlane": "submit_gateway",
        "tokenPossession": "not_performed",
        "tokenRedemption": "not_performed",
        "validationScope": "payload_and_expected_context_only"
      }
    },
    {
      "caseId": "recovery_gateway_valid",
      "payload": {
        "authority": "none",
        "environmentId": "fixture-eu",
        "evidenceId": "55555555-5555-4555-8555-555555555555",
        "evidenceKind": "gateway_token_commitment",
        "expiresAt": "2026-07-15T12:08:00.000+00:00",
        "issuedAt": "2026-07-15T12:03:00.000+00:00",
        "nonceSha256": "sha256:ffffffffffffffffffffffffffffffffffffffffffffffffffffffffffffffff",
        "observedAt": "2026-07-15T12:03:00.000+00:00",
        "projectId": "grand-hall",
        "purpose": "provider_command_claim_token",
        "queueScope": "recovery.normalized-glb-v0",
        "redemptionTokenSha256": "sha256:0000000000000000000000000000000000000000000000000000000000000000",
        "schemaVersion": "omnitwin.foundry.derivative-gateway-token-commitment.v1",
        "signerAuthorizationId": "66666666-6666-4666-8666-666666666666",
        "signerAuthorizationSha256": "sha256:1111111111111111111111111111111111111111111111111111111111111111",
        "subjectId": "77777777-7777-4777-8777-777777777777",
        "subjectKind": "provider_command",
        "subjectSha256": "sha256:2222222222222222222222222222222222222222222222222222222222222222",
        "targetCallerAuthorizationId": "88888888-8888-4888-8888-888888888888",
        "targetCallerAuthorizationSha256": "sha256:3333333333333333333333333333333333333333333333333333333333333333",
        "targetPlane": "recovery_gateway",
        "tenantId": "venviewer"
      },
      "expectedContext": {
        "environmentId": "fixture-eu",
        "maximumExpiresAt": "2026-07-15T12:10:00.000+00:00",
        "projectId": "grand-hall",
        "queueScope": "recovery.normalized-glb-v0",
        "schemaVersion": "omnitwin.foundry.activation-v1-gateway-token-commitment-expected-context.v0",
        "signerAuthorizationId": "66666666-6666-4666-8666-666666666666",
        "signerAuthorizationSha256": "sha256:1111111111111111111111111111111111111111111111111111111111111111",
        "subjectId": "77777777-7777-4777-8777-777777777777",
        "subjectSha256": "sha256:2222222222222222222222222222222222222222222222222222222222222222",
        "targetCallerAuthorizationId": "88888888-8888-4888-8888-888888888888",
        "targetCallerAuthorizationSha256": "sha256:3333333333333333333333333333333333333333333333333333333333333333",
        "targetPlane": "recovery_gateway",
        "tenantId": "venviewer"
      },
      "expectedResult": {
        "authority": "none",
        "canonicalByteVerification": "not_performed",
        "databaseAdmission": "not_performed",
        "evidenceId": "55555555-5555-4555-8555-555555555555",
        "nonceUniqueness": "not_performed",
        "queueDelivery": "not_performed",
        "redemptionTokenGeneration": "not_performed",
        "runtimeAuthority": "none",
        "schemaVersion": "omnitwin.foundry.activation-v1-gateway-token-commitment-semantic-validation.v0",
        "semanticValidation": "passed",
        "signatureVerification": "not_performed",
        "signerAuthorizationCurrentness": "not_performed",
        "signerTargetPairing": "not_performed",
        "targetCallerCurrentness": "not_performed",
        "targetPlane": "recovery_gateway",
        "tokenPossession": "not_performed",
        "tokenRedemption": "not_performed",
        "validationScope": "payload_and_expected_context_only"
      }
    }
  ],
  "negativeCases": [
    {
      "caseId": "payload_carrier_not_object",
      "baseCaseId": "submit_gateway_valid",
      "mutation": { "target": "payload", "operation": "replace_target", "value": [] },
      "expectedErrorCode": "FOUNDRY_ACTIVATION_V1_GATEWAY_TOKEN_COMMITMENT_INPUT_SHAPE_INVALID"
    },
    {
      "caseId": "unknown_payload_member",
      "baseCaseId": "submit_gateway_valid",
      "mutation": { "target": "payload", "operation": "add", "member": "debug", "value": "forbidden" },
      "expectedErrorCode": "FOUNDRY_ACTIVATION_V1_GATEWAY_TOKEN_COMMITMENT_PAYLOAD_SCHEMA_INVALID"
    },
    {
      "caseId": "token_plaintext_forbidden",
      "baseCaseId": "submit_gateway_valid",
      "mutation": { "target": "payload", "operation": "add", "member": "redemptionTokenPlaintext", "value": "forbidden" },
      "expectedErrorCode": "FOUNDRY_ACTIVATION_V1_GATEWAY_TOKEN_COMMITMENT_PAYLOAD_SCHEMA_INVALID"
    },
    {
      "caseId": "purpose_literal_wrong",
      "baseCaseId": "submit_gateway_valid",
      "mutation": { "target": "payload", "operation": "replace", "member": "purpose", "value": "generic_claim" },
      "expectedErrorCode": "FOUNDRY_ACTIVATION_V1_GATEWAY_TOKEN_COMMITMENT_PAYLOAD_SCHEMA_INVALID"
    },
    {
      "caseId": "required_member_missing",
      "baseCaseId": "submit_gateway_valid",
      "mutation": { "target": "payload", "operation": "remove", "member": "queueScope" },
      "expectedErrorCode": "FOUNDRY_ACTIVATION_V1_GATEWAY_TOKEN_COMMITMENT_PAYLOAD_SCHEMA_INVALID"
    },
    {
      "caseId": "numeric_leaf_forbidden",
      "baseCaseId": "submit_gateway_valid",
      "mutation": { "target": "payload", "operation": "replace", "member": "issuedAt", "value": 1 },
      "expectedErrorCode": "FOUNDRY_ACTIVATION_V1_GATEWAY_TOKEN_COMMITMENT_PAYLOAD_SCHEMA_INVALID"
    },
    {
      "caseId": "null_leaf_forbidden",
      "baseCaseId": "submit_gateway_valid",
      "mutation": { "target": "payload", "operation": "replace", "member": "queueScope", "value": null },
      "expectedErrorCode": "FOUNDRY_ACTIVATION_V1_GATEWAY_TOKEN_COMMITMENT_PAYLOAD_SCHEMA_INVALID"
    },
    {
      "caseId": "calendar_invalid",
      "baseCaseId": "submit_gateway_valid",
      "mutation": { "target": "payload", "operation": "replace", "member": "expiresAt", "value": "2026-02-30T12:02:00.000+00:00" },
      "expectedErrorCode": "FOUNDRY_ACTIVATION_V1_GATEWAY_TOKEN_COMMITMENT_PAYLOAD_SCHEMA_INVALID"
    },
    {
      "caseId": "expected_context_member_missing",
      "baseCaseId": "submit_gateway_valid",
      "mutation": { "target": "expectedContext", "operation": "remove", "member": "queueScope" },
      "expectedErrorCode": "FOUNDRY_ACTIVATION_V1_GATEWAY_TOKEN_COMMITMENT_EXPECTED_CONTEXT_SCHEMA_INVALID"
    },
    {
      "caseId": "target_plane_context_mismatch",